{
  "$schema": "./plugin.schema.json",
  "name": "Plugin Template",
  "title": {
    "en_US": "Plugin Template",
    "de_DE": "Plugin Template"
  },
  "description": "Starter template for Staffbase custom plugins. Provides session/SSO/GDPR/changelog/settings infrastructure with empty Admin and End User views ready for feature work.",
  "version": "2026.23.1",
  "pluginId": "CONFIGURED_VIA_PLUGIN_ID_ENV",
  "_comment_pluginId": "The actual plugin UUID is assigned by the Staffbase platform per environment. Set PLUGIN_ID in the deployment environment.",
  "entryPoints": {
    "frontend": "/",
    "backoffice": "/admin",
    "api": "/api"
  },
  "permissions": [
    "read:userprofile",
    "read:branch"
  ],
  "scopes": [
    "plugin-user",
    "plugin-editor"
  ],
  "storage": {
    "database": "postgres",
    "tables": [
      "users",
      "sessions",
      "settings",
      "changelog",
      "items"
    ]
  },
  "widgets": [
    {
      "tagName": "plugin-template-widget",
      "title": "Plugin Template Widget",
      "description": "Scaffolding widget for a Staffbase custom plugin. Replace the placeholder rendering in widget/src/widget.ts with your plugin-specific UI.",
      "module": "staffbase.plugin-template-widget.min.js",
      "configAttributes": [
        "installation_id"
      ]
    }
  ]
}
